{
  "schemaVersion": "2.6",
  "seedId": "0x1111111111111111111111111111111111111111111111111111111111111111",
  "requestId": "0x2222222222222222222222222222222222222222222222222222222222222222",
  "profileId": "0x3333333333333333333333333333333333333333333333333333333333333333",
  "ciphertextHash": "0x4444444444444444444444444444444444444444444444444444444444444444",
  "plaintextHash": "0x5555555555555555555555555555555555555555555555555555555555555555",
  "threshold": {
    "requiredShares": 2,
    "collectedShares": 3
  },
  "signers": [
    {
      "nodeId": "lit-node-01",
      "signature": "0xabcdef1234567890"
    }
  ],
  "completedAt": "2026-04-18T00:00:00Z"
}
